{"$schema":"https://json-schema.org/draft/2020-12/schema","$id":"https://github.com/hvitiswift-afk/nextjs-boilerplate/schemas/revenue/fardarter-drive-successor-review-bundle-v6-6.schema.json","title":"Fardarter Drive Successor Review Bundle v6.6","type":"object","additionalProperties":false,"required":["schemaVersion","bundleId","driveId","controllerVersion","controllingIssue","state","decision","source","candidateEvent","candidateReconciliation","evidenceMatrix","authorityMatrix","review","actualEffects","googleDriveContinuity","generatedAt","bundleDigest"],"properties":{"schemaVersion":{"const":"1.0.0"},"bundleId":{"const":"FARDARTER-SUCCESSOR-REVIEW-BUNDLE-ISSUE-159-V6-6"},"driveId":{"const":"FARDARTER-DRIVE-V6"},"controllerVersion":{"const":"6.6.0"},"controllingIssue":{"const":173},"state":{"const":"BLOCKED"},"decision":{"const":"BLOCKED_MISSING_GATE_EVIDENCE"},"source":{"type":"object"},"candidateEvent":{"type":"object","required":["sequence","fromState","toState","authorityGate","previousEventDigest","candidateDigest","canonical","applied","missingEvidence"],"properties":{"sequence":{"const":2},"fromState":{"const":"SCOPE_DRAFTED"},"toState":{"const":"HUMAN_ACCEPTED"},"authorityGate":{"const":"HUMAN_APPROVAL_AND_BUYER_CONSENT"},"previousEventDigest":{"const":"3859eac9c63bef83624111704d38cf217b0c1a4ece6df874e72a76e9fb1ffc3b"},"candidateDigest":{"const":"6e9ec1a02d85b2894d8388bfc3bcc7d4d79147703d3ea68b2bbc9b358a3829b2"},"canonical":{"const":false},"applied":{"const":false},"missingEvidence":{"type":"array","minItems":3}}},"candidateReconciliation":{"type":"object","required":["sequence","previousSnapshotDigest","snapshotDigest","decision"],"properties":{"sequence":{"const":2},"previousSnapshotDigest":{"const":"9f4f878cc0f8f2ddfa7bbdb594d2b9164064acd8901301404aed57b4065eca0f"},"snapshotDigest":{"const":"5891a56c76f102573461c64d281f4cac6e785d2737b3ec8d5b5d170cfbd7b245"},"decision":{"const":"BLOCKED_MISSING_GATE_EVIDENCE"}}},"evidenceMatrix":{"type":"array","minItems":6},"authorityMatrix":{"type":"array","minItems":6},"review":{"type":"object"},"actualEffects":{"const":{"canonicalEventAppended":false,"customerCreated":false,"orderCreated":false,"contractAccepted":false,"paymentObligationCreated":false,"paymentProved":false,"paidWorkStarted":false,"activeCapacityUsed":false,"capacityCeilingChanged":false,"legalTermsSelected":false,"indemnityResultCreated":false}},"googleDriveContinuity":{"type":"object"},"generatedAt":{"type":"string","format":"date-time"},"bundleDigest":{"const":"8f3312568414fcad5d33bc8ee44d4c04f6d54117dce250c62d31c4491b6638f2"}}}
