{
  "schemaVersion": "1.0.0",
  "bundleId": "FARDARTER-SUCCESSOR-REVIEW-BUNDLE-ISSUE-159-V6-6",
  "driveId": "FARDARTER-DRIVE-V6",
  "controllerVersion": "6.6.0",
  "controllingIssue": 173,
  "state": "BLOCKED",
  "decision": "BLOCKED_MISSING_GATE_EVIDENCE",
  "source": {
    "entityIssue": 159,
    "currentCanonicalState": "SCOPE_DRAFTED",
    "currentHeadSequence": 1,
    "currentHeadDigest": "3859eac9c63bef83624111704d38cf217b0c1a4ece6df874e72a76e9fb1ffc3b",
    "currentReconciliationSequence": 1,
    "currentReconciliationDigest": "9f4f878cc0f8f2ddfa7bbdb594d2b9164064acd8901301404aed57b4065eca0f",
    "currentApplicationDigest": "f2285c4c02c10f4403302600f092926b519d0c2e2c5d0d3e9d078fbf7828be3d"
  },
  "candidateEvent": {
    "schemaVersion": "1.0.0",
    "candidateId": "FARDARTER-SUCCESSOR-CANDIDATE-ISSUE-159-V6-6",
    "sequence": 2,
    "eventType": "STATE_TRANSITION_CANDIDATE",
    "idempotencyKey": "issue-159-scope-to-human-accepted-v6-6",
    "entityType": "GITHUB_ISSUE",
    "entityId": "159",
    "fromState": "SCOPE_DRAFTED",
    "toState": "HUMAN_ACCEPTED",
    "classification": "CANDIDATE_NONCANONICAL_BLOCKED",
    "authorityGate": "HUMAN_APPROVAL_AND_BUYER_CONSENT",
    "sourceEvidence": [
      "Fardarter canonical event head sequence 1",
      "GitHub Issue #159",
      "GitHub Issue #173",
      "Fardarter Drive state machine v6.2"
    ],
    "missingEvidence": [
      "EXACT_JP_APPLICATION_DECISION",
      "BUYER_CONSENT",
      "BINDING_SCOPE_ACCEPTANCE"
    ],
    "capacityEffect": {
      "usesActiveCapacity": false,
      "activeDelta": 0
    },
    "financialEffect": {
      "createsOrder": true,
      "orderDelta": 1,
      "grossRevenueDeltaUsd": 0,
      "settledCashDeltaUsd": 0,
      "settlementState": "UNKNOWN"
    },
    "previousEventDigest": "3859eac9c63bef83624111704d38cf217b0c1a4ece6df874e72a76e9fb1ffc3b",
    "occurredAt": "2026-07-30T10:18:00Z",
    "recordedAt": "2026-07-30T10:18:00Z",
    "canonical": false,
    "applied": false,
    "publicSafe": true,
    "sensitiveDataPresent": false,
    "candidateDigest": "6e9ec1a02d85b2894d8388bfc3bcc7d4d79147703d3ea68b2bbc9b358a3829b2"
  },
  "candidateReconciliation": {
    "schemaVersion": "1.0.0",
    "snapshotId": "FARDARTER-SUCCESSOR-RECONCILIATION-ISSUE-159-V6-6",
    "sequence": 2,
    "previousSnapshotDigest": "9f4f878cc0f8f2ddfa7bbdb594d2b9164064acd8901301404aed57b4065eca0f",
    "controllerVersion": "6.6.0",
    "controllingIssue": 173,
    "candidateEvent": {
      "candidateId": "FARDARTER-SUCCESSOR-CANDIDATE-ISSUE-159-V6-6",
      "sequence": 2,
      "candidateDigest": "6e9ec1a02d85b2894d8388bfc3bcc7d4d79147703d3ea68b2bbc9b358a3829b2",
      "applied": false
    },
    "currentCanonical": {
      "headSequence": 1,
      "headDigest": "3859eac9c63bef83624111704d38cf217b0c1a4ece6df874e72a76e9fb1ffc3b",
      "stateCounts": {
        "REQUESTED": 0,
        "FIT_APPROVED_FOR_SCOPE_DRAFT": 0,
        "SCOPE_DRAFTED": 1,
        "HUMAN_ACCEPTED": 0,
        "PAID_PENDING": 0,
        "PAID_SETTLED": 0,
        "WORK_START_APPROVED": 0,
        "ACTIVE": 0,
        "DELIVERED": 0,
        "ACCEPTED": 0,
        "CANCELLED": 0,
        "REFUNDED": 0,
        "DISPUTED": 0
      }
    },
    "projectionIfApplied": {
      "stateCounts": {
        "REQUESTED": 0,
        "FIT_APPROVED_FOR_SCOPE_DRAFT": 0,
        "SCOPE_DRAFTED": 0,
        "HUMAN_ACCEPTED": 1,
        "PAID_PENDING": 0,
        "PAID_SETTLED": 0,
        "WORK_START_APPROVED": 0,
        "ACTIVE": 0,
        "DELIVERED": 0,
        "ACCEPTED": 0,
        "CANCELLED": 0,
        "REFUNDED": 0,
        "DISPUTED": 0
      },
      "totalPlanningSlots": 1000,
      "effectiveActiveCeiling": 100,
      "activeDeliveries": 0,
      "activeHeadroom": 100,
      "overrideState": "INACTIVE_NO_RECEIPT",
      "orders": 1,
      "verifiedGrossRevenueUsd": 0,
      "verifiedSettledCashUsd": 0,
      "settlementState": "UNKNOWN",
      "receivedCashRequires": "PAID_SETTLED"
    },
    "decision": "BLOCKED_MISSING_GATE_EVIDENCE",
    "generatedAt": "2026-07-30T10:18:00Z",
    "snapshotDigest": "5891a56c76f102573461c64d281f4cac6e785d2737b3ec8d5b5d170cfbd7b245"
  },
  "evidenceMatrix": [
    {"evidenceId":"EV-CANONICAL-HEAD","classification":"PUBLIC_SAFE","verificationState":"VERIFIED","required":true,"privateLocationRequired":false},
    {"evidenceId":"EV-STATE-TRANSITION-MAP","classification":"PUBLIC_SAFE","verificationState":"VERIFIED","required":true,"privateLocationRequired":false},
    {"evidenceId":"EV-JP-APPLICATION-DECISION","classification":"PRIVATE","verificationState":"MISSING","required":true,"privateLocationRequired":true},
    {"evidenceId":"EV-BUYER-CONSENT","classification":"PRIVATE","verificationState":"MISSING","required":true,"privateLocationRequired":true},
    {"evidenceId":"EV-BINDING-SCOPE-ACCEPTANCE","classification":"PRIVATE","verificationState":"MISSING","required":true,"privateLocationRequired":true},
    {"evidenceId":"EV-CAPACITY-HEADROOM","classification":"PUBLIC_SAFE","verificationState":"VERIFIED","required":false,"privateLocationRequired":false}
  ],
  "authorityMatrix": [
    {"gate":"DYNAMIC_HEAD_RESOLUTION","decisionMaker":"AUTOMATION","status":"AUTHORIZED_ACTIVE","blocker":null},
    {"gate":"NONCANONICAL_SUCCESSOR_REVIEW","decisionMaker":"AUTOMATION","status":"AUTHORIZED_ACTIVE","blocker":null},
    {"gate":"HUMAN_ACCEPTED_TRANSITION","decisionMaker":"JP_AND_BUYER","status":"BLOCKED","blocker":"MISSING_GATE_EVIDENCE"},
    {"gate":"CANONICAL_EVENT_APPEND","decisionMaker":"JP_REVIEWED_MERGE","status":"NOT_AUTHORIZED_BY_REVIEW","blocker":"NO_REVIEWED_EVENT_2_MERGE"},
    {"gate":"PAYMENT_SETTLEMENT","decisionMaker":"EXTERNAL_PROVIDER","status":"NOT_APPLICABLE","blocker":null},
    {"gate":"PAID_WORK_START","decisionMaker":"JP_AND_CAPACITY","status":"NOT_APPLICABLE","blocker":null}
  ],
  "review": {
    "reviewBy": "2026-08-03T23:59:59Z",
    "unresolvedBlockers": [
      "EXACT_JP_APPLICATION_DECISION",
      "BUYER_CONSENT",
      "BINDING_SCOPE_ACCEPTANCE",
      "NO_REVIEWED_EVENT_2_MERGE"
    ],
    "rollbackInstruction": "Discard the candidate and preserve event head sequence 1 and reconciliation sequence 1."
  },
  "actualEffects": {
    "canonicalEventAppended": false,
    "customerCreated": false,
    "orderCreated": false,
    "contractAccepted": false,
    "paymentObligationCreated": false,
    "paymentProved": false,
    "paidWorkStarted": false,
    "activeCapacityUsed": false,
    "capacityCeilingChanged": false,
    "legalTermsSelected": false,
    "indemnityResultCreated": false
  },
  "googleDriveContinuity": {
    "state": "CONNECTED_PRIVATE",
    "documentTitles": [
      "Fardarter Drive™ v6.6 — Dynamic Head and Successor Event Charter",
      "Fardarter Drive™ v6.6 — Successor Review and Gate Register"
    ],
    "publicReferencesExposed": false
  },
  "generatedAt": "2026-07-30T10:18:00Z",
  "bundleDigest": "8f3312568414fcad5d33bc8ee44d4c04f6d54117dce250c62d31c4491b6638f2"
}
